{
  "$schema": "https://json-schema.org/draft/2020-12/schema",
  "$id": "https://symposium.dev/schemas/v1.0.0/persona.schema.json",
  "title": "Persona",
  "description": "A declarative profile bound to an agent at configuration time. Two persona classes are distinguished by the `persona_class` discriminator: `horizontal` (cross-domain cognitive style) and `domain` (bounded expertise). The required-field set differs per class (§2.3, A5, Pass 1 Q2).",
  "type": "object",
  "required": ["persona_class", "id", "reasoning_scope", "reasoning_style", "behavioral_constraints", "failure_modes"],
  "properties": {
    "persona_class": {
      "description": "Persona class discriminator (§2.3). `horizontal` reasons across domains; `domain` is bounded to a domain.",
      "enum": ["horizontal", "domain"]
    },
    "id": {
      "description": "Stable persona identifier (e.g. `logician`, `legal_analyst`). Bound to an `agent` at configuration time.",
      "type": "string",
      "minLength": 1
    },
    "reasoning_scope": {
      "description": "Breadth of cognitive style the persona applies (e.g. `formal-structural`, `lateral-creative`, `evidence-based`).",
      "type": "string",
      "minLength": 1
    },
    "reasoning_style": {
      "description": "Persona's manner of reasoning (e.g. `mathematical rigor`, `lateral exploration`, `adversarial scrutiny`).",
      "type": "string",
      "minLength": 1
    },
    "behavioral_constraints": {
      "description": "Behavioral rules (e.g. cite sources when available, target criticism at reasoning not at people).",
      "type": "array",
      "items": {"type": "string", "minLength": 1},
      "minItems": 1
    },
    "failure_modes": {
      "description": "Expected failure patterns (e.g. over-confident speculation, scope drift).",
      "type": "array",
      "items": {"type": "string", "minLength": 1},
      "minItems": 1
    },
    "output_requirements": {
      "description": "Per-turn output expectations (e.g. `identify assumptions`, `list missing definitions`). Distinct from the persona role/prompt body (Pass 1 row #24b).",
      "type": "array",
      "items": {"type": "string", "minLength": 1}
    },
    "domain_scope": {
      "description": "Domains in which the persona is competent to opine. Required for `domain` personas; absent for `horizontal` personas.",
      "type": "array",
      "items": {"type": "string", "minLength": 1},
      "minItems": 1
    },
    "forbidden_domains": {
      "description": "Domains in which the persona does not opine, paired with `must_delegate` entries. Required for `domain` personas; absent for `horizontal` personas.",
      "type": "array",
      "items": {"type": "string", "minLength": 1}
    },
    "must_delegate": {
      "description": "Mapping from each entry in `forbidden_domains` to the persona id the agent must address via `direct_request` when that domain comes up. Required for `domain` personas.",
      "type": "object",
      "additionalProperties": {"type": "string", "minLength": 1}
    },
    "status": {
      "description": "Optional lifecycle status (Roadmap, Pass 1 row #155). MVP runtimes ignore this field.",
      "enum": ["experimental", "stable", "deprecated", "archived"]
    }
  },
  "additionalProperties": false,
  "allOf": [
    {
      "if": {"properties": {"persona_class": {"const": "horizontal"}}, "required": ["persona_class"]},
      "then": {
        "not": {
          "anyOf": [
            {"required": ["domain_scope"]},
            {"required": ["forbidden_domains"]},
            {"required": ["must_delegate"]}
          ]
        }
      }
    },
    {
      "if": {"properties": {"persona_class": {"const": "domain"}}, "required": ["persona_class"]},
      "then": {
        "required": ["domain_scope", "forbidden_domains", "must_delegate"]
      }
    }
  ]
}
